{
  "$schema": "https://json-schema.org/draft/2020-12/schema",
  "$id": "https://github.com/werkrbee/ai-hive/blob/main/hives/agents-hive/schema/passport.schema.json",
  "title": "Agent passport",
  "description": "An agent's versioned metadata: who it is, who owns it, what it may and may not do, and which versions of its model, prompt and policy it runs. It points at the agent's execution contract and approval policy and can only narrow them. Design: docs/assurance-loop.md.",
  "type": "object",
  "required": ["passport", "version", "owner", "contract", "policy", "permissions", "budget", "delegates", "pins"],
  "additionalProperties": false,
  "properties": {
    "$schema": { "type": "string" },
    "passport": {
      "description": "The persona's name, the same as its card's and its skill's or agent's directory.",
      "type": "string",
      "pattern": "^[a-z0-9]+(-[a-z0-9]+)*$"
    },
    "version": {
      "description": "Bumped on any change to the passport, including a change to any pin.",
      "type": "integer",
      "minimum": 1
    },
    "owner": {
      "description": "The GitHub account or team accountable for the agent: @account or @org/team.",
      "type": "string",
      "pattern": "^@[A-Za-z0-9](-?[A-Za-z0-9])*(/[A-Za-z0-9._-]+)?$"
    },
    "contract": {
      "description": "The execution contract the agent runs under (contracts/<capability>/contract.json).",
      "type": "object",
      "required": ["capability", "version"],
      "additionalProperties": false,
      "properties": {
        "capability": { "type": "string", "pattern": "^[a-z0-9]+(-[a-z0-9]+)*$" },
        "version": { "type": "integer", "minimum": 1 }
      }
    },
    "policy": {
      "description": "The approval policy the agent is held to, as a path from the repo root, and its version.",
      "type": "object",
      "required": ["ruleset", "version"],
      "additionalProperties": false,
      "properties": {
        "ruleset": { "type": "string", "pattern": "^hives/.+\\.json$" },
        "version": { "type": "integer", "minimum": 1 }
      }
    },
    "permissions": {
      "description": "What the agent may do, narrowed from its contract. Every action granted or under approval is one the contract grants or puts under approval, and nothing the contract puts under approval is granted. Anything in no list is denied.",
      "type": "object",
      "required": ["granted", "approval", "never"],
      "additionalProperties": false,
      "properties": {
        "granted": { "$ref": "#/$defs/actions" },
        "approval": { "$ref": "#/$defs/actions" },
        "never": {
          "description": "Actions the agent may not take even with a human's approval. Each becomes a prohibition when the engine decides the agent's steps.",
          "$ref": "#/$defs/actions"
        }
      }
    },
    "budget": {
      "description": "Ceilings for one invocation, each at most the contract's. A figure the passport leaves out is the contract's.",
      "type": "object",
      "minProperties": 1,
      "additionalProperties": false,
      "properties": {
        "usd": { "type": "number", "exclusiveMinimum": 0 },
        "tokens": { "type": "integer", "minimum": 1 },
        "seconds": { "type": "integer", "minimum": 1 }
      }
    },
    "delegates": {
      "description": "The passports this agent may delegate to.",
      "type": "array",
      "uniqueItems": true,
      "items": { "type": "string", "pattern": "^[a-z0-9]+(-[a-z0-9]+)*$" }
    },
    "pins": {
      "description": "The versions the agent runs on. A change to any of them is a new passport version.",
      "type": "object",
      "required": ["prompt", "policy"],
      "additionalProperties": false,
      "properties": {
        "model": {
          "description": "The model by its catalog publisher, name and version. Left out for an agent run inside a harness, which picks the model.",
          "type": "object",
          "required": ["publisher", "name", "version"],
          "additionalProperties": false,
          "properties": {
            "publisher": { "type": "string", "pattern": "^[a-z0-9-]+$" },
            "name": { "type": "string", "minLength": 1 },
            "version": { "type": "string", "minLength": 1 }
          }
        },
        "prompt": {
          "description": "Every file the agent's prompt is built from, as a path from the repo root, with its SHA-256 (CRLF line endings read as LF).",
          "type": "array",
          "minItems": 1,
          "items": {
            "type": "object",
            "required": ["path", "sha256"],
            "additionalProperties": false,
            "properties": {
              "path": { "type": "string", "pattern": "^hives/" },
              "sha256": { "$ref": "#/$defs/sha256" }
            }
          }
        },
        "policy": {
          "description": "The SHA-256 of the approval policy file named in policy.ruleset (CRLF line endings read as LF).",
          "type": "object",
          "required": ["sha256"],
          "additionalProperties": false,
          "properties": { "sha256": { "$ref": "#/$defs/sha256" } }
        }
      }
    },
    "eval": {
      "description": "The agent's trust evaluation. Needs a model pin, since a baseline belongs to a model.",
      "type": "object",
      "required": ["suite", "baseline", "threshold"],
      "additionalProperties": false,
      "properties": {
        "suite": { "description": "The cases file, as a path from the repo root.", "type": "string", "pattern": "^hives/" },
        "baseline": {
          "description": "The cases the pinned versions met, and where that run is recorded.",
          "type": "object",
          "required": ["met", "of", "result", "commit"],
          "additionalProperties": false,
          "properties": {
            "met": { "type": "integer", "minimum": 0 },
            "of": { "type": "integer", "minimum": 1 },
            "result": { "description": "Where the run is recorded, as a path from the repo root with an optional #anchor.", "type": "string", "pattern": "^hives/" },
            "commit": { "description": "The commit the run was made from.", "type": "string", "pattern": "^[0-9a-f]{7,40}$" }
          }
        },
        "threshold": {
          "description": "How many cases below the baseline a run may meet before it drifts. A missed critical case is drift whatever the threshold.",
          "type": "integer",
          "minimum": 0
        }
      }
    }
  },
  "$defs": {
    "actions": {
      "type": "array",
      "uniqueItems": true,
      "items": { "anyOf": [
        { "$ref": "execution-contract.schema.json#/$defs/ungated" },
        { "$ref": "execution-contract.schema.json#/$defs/gated" }
      ] }
    },
    "sha256": { "type": "string", "pattern": "^[0-9a-f]{64}$" }
  }
}
