{
  "$schema": "../../schema/passport.schema.json",
  "passport": "barry",
  "version": 2,
  "owner": "@werkrbee",
  "contract": { "capability": "orchestration", "version": 1 },
  "policy": { "ruleset": "hives/rules-hive/rules/queen-charter/policy.json", "version": 2 },
  "permissions": {
    "granted": ["fs.read", "fs.write", "shell.exec", "net.fetch", "agent.delegate"],
    "approval": [
      "vcs.commit", "vcs.push", "vcs.merge", "vcs.release", "vcs.delete-ref",
      "fs.delete", "deploy", "message.send", "spend"
    ],
    "never": ["infra.change"]
  },
  "budget": { "usd": 5, "tokens": 2000000, "seconds": 3600 },
  "delegates": ["patricia"],
  "pins": {
    "prompt": [
      { "path": "hives/rules-hive/rules/queen-charter/AGENTS.md", "sha256": "79ea53fdeff1bc0348c7d8436e3102970175fc4e7605d71f214e5f6bb1267167" },
      { "path": "hives/skills-hive/skills/barry/SKILL.md", "sha256": "12257889bb332dea87dd89e93a8d994edc75c2b2e7625b354629f839ad98ec10" },
      { "path": "hives/skills-hive/skills/barry/references/fleet.md", "sha256": "b1e92b0243b28beaba6cf0a80abda844029cc719e1d4107d80b35d0d75c8f4b4" }
    ],
    "policy": { "sha256": "9a08039ec64eba44e2c049d699e6bf0af676bba845f586b396549562ecc55ec6" }
  }
}
